Object Type,Title,Item ARK,Parent ARK,File Name,Thumbnail,Item Sequence,AltTitle.other,collection.physical,Contents note,Date.created,Date.normalized,Description.latitude,Description.longitude,Summary,Format.dimensions,Format.extent,Format.medium,Genre,Language,Local identifier,Name.creator,Name.subject,Note,Place of origin,Publisher.publisherName,Repository,Type.typeOfResource,Rights.copyrightStatus,Rights.rightsHolderContact,Statement of Responsibility,Subject geographic,Subject temporal,viewingHint,Subject topic,IIIF Manifest URL
Work,"""Jelly"" Notebook",ark:/21198/z1kd3x4d,ark:/21198/z1q54nw5|~|ark:/21198/z1zk7d59,,https://iiif.library.ucla.edu/iiif/2/ark%3A%2F21198%2Fz1hd9tzk,,,,,Between 1980 and 1989,1980/1989,,,"Prisoners used a discarded jello box to create a cover for a notebook, fastened together with a medical bandage glued to the inside of the cover. The notebook contains a handwritten copy of a book entitled ʿIlm al-Maʿānī. The title is written in large letters on page one. The first 11 of the 45 pages have writing. Starting from the back, the last four pages contain writing, upside down. This was the last notebook they used and they did not fill it.",,1 notebook,,diaries,ara,auis_ec_00013,Adnan Mohammad Hasan,,,,,"Collection of Adnan Mohammad Hassan, Baghdad, Iraq",text,,"https://auis.edu.krd, info@auis.edu.krd",,,,individuals,Baghdad (Iraq)—Social life and customs,https://iiif.library.ucla.edu/ark%3A%2F21198%2Fz1kd3x4d/manifest
Work,Letter,ark:/21198/z1fn35fh,ark:/21198/z1q54nw5|~|ark:/21198/z1zk7d59,,https://iiif.library.ucla.edu/iiif/2/ark%3A%2F21198%2Fz13797z3,,,,,Between 1980 and 1989,1980/1989,,,"Handwritten letter on paper ripped from a notebook that Adnan wrote to his eldest son Mohammad. Adnan promised his son a bicycle if he did well on his exams, but the letter took two years to arrive and his son already had a bicycle by then. ",,1 handwritten letter,,correspondence,ara,auis_ec_00014,Adnan Mohammad Hasan,,,,,"Collection of Adnan Mohammad Hassan, Baghdad, Iraq",text,,"https://auis.edu.krd, info@auis.edu.krd",,,,individuals,Baghdad (Iraq)—Social life and customs,https://iiif.library.ucla.edu/ark%3A%2F21198%2Fz1fn35fh/manifest
Work,Square Letter,ark:/21198/z19w2dsp,ark:/21198/z1q54nw5|~|ark:/21198/z1zk7d59,,https://iiif.library.ucla.edu/iiif/2/ark%3A%2F21198%2Fz1tq80tc,,,,,Between 1980 and 1989,1980/1989,,,"A short handwritten note that Adnan wrote to his wife, and a note to the wife of another prisoner. Adnan tells them that they need to put the other message he sent in the sun so that they can read the invisible ink. They destroyed the note with the invisible ink. ",,1 handwritten letter,,correspondence,ara,auis_ec_00015,Adnan Mohammad Hasan,,,,,"Collection of Adnan Mohammad Hassan, Baghdad, Iraq",text,,"https://auis.edu.krd, info@auis.edu.krd",,,,individuals,Baghdad (Iraq)—Social life and customs,https://iiif.library.ucla.edu/ark%3A%2F21198%2Fz19w2dsp/manifest
Work,"""Sumer"" Notebook",ark:/21198/z1641p17,ark:/21198/z1q54nw5|~|ark:/21198/z1zk7d59,,https://iiif.library.ucla.edu/iiif/2/ark%3A%2F21198%2Fz1pz7832,,,,,Between 1980 and 1989,1980/1989,,,"Prisoners used a discarded laundry detergent box to create a cover for a notebook filled with lined writing paper and bound with a piece of blue yarn inserted into two holes and tied in the back. The face of the woman in the picture on the cover has been worn or scraped away. Between numbered pages 42 and 43, there is a separate paper inserted with a note. The notebook contains a handwritten copy of a book that a prisoner wrote before going to prison. In prison, others copied it so they could have their own. The title of the book is written on page 1, Iḥyāʾ Ulum al-Dīn by the Imam Abu Ḥāmid al-Ghazālī, part one. The title of the book is different than the content. The author of the book was not actually al-Ghazālī, who was Sunni, but Muhammad Baqr al-Sadr, who was Shiʿi and whose book was banned outside of prison.",,1 notebook,,diaries,ara,auis_ec_00016,Adnan Mohammad Hasan,,,,,"Collection of Adnan Mohammad Hassan, Baghdad, Iraq",text,,"https://auis.edu.krd, info@auis.edu.krd",,,,individuals,Baghdad (Iraq)—Social life and customs,https://iiif.library.ucla.edu/ark%3A%2F21198%2Fz1641p17/manifest
Work,"""Sumer 2"" Notebook",ark:/21198/z12c0x9h,ark:/21198/z1q54nw5|~|ark:/21198/z1zk7d59,,https://iiif.library.ucla.edu/iiif/2/ark%3A%2F21198%2Fz1bg4n97,,,,,Between 1980 and 1989,1980/1989,,,"Prisoners used a discarded laundry detergent box to create a cover for a notebook. The faces of the women on the cover have been covered by pen scribbling. The notebook contains a handwritten copy of a book that a prisoner wrote before going to prison. In prison, others copied it so they could have their own. The notebook contains a handwritten copy of Iḥyāʾ Ulum al-Dīn by the Imam Abu Ḥāmid al-Ghazālī, part two. The title of the book is written on page 1. The title of the book is different than the content. The author of the book was not actually al-Ghazālī, who was Sunni, but Muhammad Baqr al-Sadr, who was Shiʿi and whose book was banned outside of prison.",,1 notebook,,diaries,ara,auis_ec_00017,Adnan Mohammad Hasan,,,,,"Collection of Adnan Mohammad Hassan, Baghdad, Iraq",text,,"https://auis.edu.krd, info@auis.edu.krd",,,,individuals,Baghdad (Iraq)—Social life and customs,https://iiif.library.ucla.edu/ark%3A%2F21198%2Fz12c0x9h/manifest
Work,"""Universal"" Notebook",ark:/21198/z1xp946x,ark:/21198/z1q54nw5|~|ark:/21198/z1zk7d59,,https://iiif.library.ucla.edu/iiif/2/ark%3A%2F21198%2Fz1x36wsn,,,,,Between 1980 and 1989,1980/1989,,,"A spiral notebook with the printed title ""Universal"" in English. The notebook contains a handwritten copy of a book.  The notebook has the printed title ""Universal"" in English, but in Arabic it is a ""university"" notebook, mistranslated into English. The contents include Islamic fiqh. An unfinished drawing is at the end. ",,1 notebook,,diaries,ara,auis_ec_00018,Adnan Mohammad Hasan,,,,,"Collection of Adnan Mohammad Hassan, Baghdad, Iraq",text,,"https://auis.edu.krd, info@auis.edu.krd",,,,individuals,Baghdad (Iraq)—Social life and customs,https://iiif.library.ucla.edu/ark%3A%2F21198%2Fz1xp946x/manifest
